{
  "required" : true ,
  "$schema" : "http://json-schema.org/draft-03/schema" ,
  "type" : "object" ,
  "properties" : {
    "id" : {
      "type" : "string" ,
      "required" : false
    } ,
    "name" : {
      "type" : "string" ,
      "required" : false
    } ,
    "page_index" : {
      "type" : "number" ,
      "required" : false
    } ,
    "cells" : {
      "type" : "array" ,
      "required" : false ,
      "items" : [
      ]
    }
  }
}