[
  {
    "id" : "c87595ae-14a6-42d7-acb6-008fc8e7ed3g" ,
    "name" : "Lunch Items" ,
    "page_index" : 0 ,
    "cells" : [
      {
        "page_id" : "343F7510-7214-4EB2-9B93-9DA3903327EB" ,
        "row" : 0 ,
        "column" : 0 ,
        "object_type" : "ITEM" ,
        "object_id" : "442d1344-6d2b-4238-83d0-0284dfd335d8"
      }
    ]
  } , {
    "id" : "c87595ae-14a6-42d7-acb6-008fc8e7ed3g" ,
    "name" : "Lunch Items" ,
    "page_index" : 0 ,
    "cells" : [
      {
        "page_id" : "343F7510-7214-4EB2-9B93-9DA3903327EB" ,
        "row" : 0 ,
        "column" : 0 ,
        "object_type" : "ITEM" ,
        "object_id" : "442d1344-6d2b-4238-83d0-0284dfd335d8"
      }
    ]
  }
]